{
  "version": "1.0",
  "task_description": "请回答以下问题，回答要求简洁、准确、直接给出结论。",
  "few_shot_examples": [
    {
      "question": "法国的首都是哪座城市？",
      "answer": "法国的首都是巴黎。"
    },
    {
      "question": "把「谢谢你」翻译成英文。",
      "answer": "「谢谢你」翻译成英文是 \"Thank you.\"。"
    }
  ],
  "samples": [
    { "id": 1, "category": "常识", "question": "水的化学式是什么？", "gold_answer": "水的化学式是 H₂O。" },
    { "id": 2, "category": "常识", "question": "中国的首都是哪座城市？", "gold_answer": "中国的首都是北京。" },
    { "id": 3, "category": "常识", "question": "地球绕太阳公转一周大约需要多长时间？", "gold_answer": "地球绕太阳公转一周大约需要 365 天，即一年。" },
    { "id": 4, "category": "常识", "question": "《红楼梦》的作者是谁？", "gold_answer": "《红楼梦》的作者是曹雪芹。" },
    { "id": 5, "category": "推理", "question": "如果所有的猫都怕水，咪咪是一只猫，那么咪咪怕水吗？", "gold_answer": "怕水。因为所有的猫都怕水，而咪咪是一只猫，所以咪咪怕水。" },
    { "id": 6, "category": "推理", "question": "小明比小红高，小红比小刚高，他们三人谁最矮？", "gold_answer": "小刚最矮。由小明比小红高、小红比小刚高，可得小明＞小红＞小刚，所以小刚最矮。" },
    { "id": 7, "category": "推理", "question": "篮子里有 3 个苹果，拿走 2 个，篮子里还剩几个？", "gold_answer": "篮子里还剩 1 个苹果。" },
    { "id": 8, "category": "推理", "question": "如果今天是星期三，那么后天是星期几？", "gold_answer": "后天是星期五。今天星期三，明天星期四，后天星期五。" },
    { "id": 9, "category": "翻译", "question": "把「人工智能正在改变世界」翻译成英文。", "gold_answer": "Artificial intelligence is changing the world." },
    { "id": 10, "category": "翻译", "question": "把 \"Knowledge is power.\" 翻译成中文。", "gold_answer": "知识就是力量。" },
    { "id": 11, "category": "翻译", "question": "把「机器学习是人工智能的一个分支」翻译成英文。", "gold_answer": "Machine learning is a branch of artificial intelligence." },
    { "id": 12, "category": "翻译", "question": "把 \"Practice makes perfect.\" 翻译成中文。", "gold_answer": "熟能生巧。" },
    { "id": 13, "category": "代码", "question": "用 Python 写一个函数，计算两个数的和。", "gold_answer": "def add(a, b):\n    return a + b" },
    { "id": 14, "category": "代码", "question": "Python 中如何反转一个字符串？", "gold_answer": "使用切片 s[::-1] 即可反转字符串。" },
    { "id": 15, "category": "代码", "question": "用 Python 列表推导式生成 1 到 10 的平方列表。", "gold_answer": "[x**2 for x in range(1, 11)]" },
    { "id": 16, "category": "代码", "question": "Python 中 == 和 is 的区别是什么？", "gold_answer": "== 比较两个对象的值是否相等，is 比较两个对象是否为同一个对象（内存地址相同）。" },
    { "id": 17, "category": "数学", "question": "计算 15 × 12 的结果。", "gold_answer": "15 × 12 = 180。" },
    { "id": 18, "category": "数学", "question": "一个数的 3 倍加上 5 等于 20，这个数是多少？", "gold_answer": "设这个数为 x，则 3x + 5 = 20，解得 x = 5。" },
    { "id": 19, "category": "数学", "question": "1 到 100 的整数之和是多少？", "gold_answer": "5050。由等差数列求和公式：(1 + 100) × 100 ÷ 2 = 5050。" },
    { "id": 20, "category": "数学", "question": "圆的半径为 3，面积是多少？（π 取 3.14）", "gold_answer": "面积 = πr² = 3.14 × 3² = 28.26。" }
  ]
}
